{
    "$schema": "./browser-machine-parity.schema.json",
    "schema": "kumwe-browser-machine-parity/v1",
    "authority": "docs/machine-contract/README.md",
    "note": "Every administrator and portal browser route, the application operations it performs, and how an agent performs the same work. An equivalent operation names the application service method the browser handler calls and the REST operation ids, CLI command actions and MCP tools that call it with the same authorization, revisions, idempotency, audit and refusals; a surface that withholds it carries a reason from surface_exemption_reasons. A browser-only operation carries a reason from browser_only_reasons. composition marks an equivalence reached by composing the listed operations. tools/verify-browser-machine-parity.php (composer machine:parity) fails on an unrecorded route, a stale entry, an unknown machine operation or service, or any gap. An equivalent operation whose machine surfaces authorize with less assurance than the browser carries an assurance_gap naming both sides and its decision status; the architecture suite pins that list, so it cannot grow silently.",
    "machine_contracts": {
        "rest": "The current generation named by api/openapi/generations.json",
        "cli": "src/Delivery/Console/Contract/cli-v3.json",
        "mcp": "Kumwe\\App\\Infrastructure\\Mcp\\McpCapabilityCatalog"
    },
    "browser_only_reasons": {
        "authentication": "The sign-in and sign-out forms and the browser session cookie. Machine callers authenticate with site-bound bearer or stdio tokens on every call.",
        "human-credential": "The signed-in human's own password and second factor: change, enroll, confirm, challenge and recovery codes. A machine credential is a token, and MCP never accepts an authentication secret.",
        "session-context": "Selecting the organization and workspace a browser session acts in. A machine credential is bound to its scope when it is issued.",
        "human-decision": "A maker-checker decision or a change the application service gates on a fresh single-use human step-up proof bound to a browser session. A machine actor may request or cancel but never decide.",
        "presentation-preference": "Per-user layout preferences of the browser interface; no application data changes.",
        "navigation": "A landing page of links and counts; machine_readable_via names the operations that read the same data.",
        "html-presentation": "An HTML-only step (a picker, a confirmation or form re-render, a component gallery) over data machine callers read through machine_readable_via; nothing is written.",
        "refusal-only": "A route registered only so a misdirected submission is refused.",
        "studio-preview": "The Studio preview document, its stylesheet and the preview port that renders a draft into the sandboxed frame.",
        "studio-shell": "Studio shell affordances with no application effect: interface strings, the session permission projection, crash-recovery snapshots of unsaved editor state and client telemetry.",
        "transfer-protocol": "A leg of the browser's granted direct-binary upload handshake. The application effect is the accepted asset, which machine_readable_via creates in one call.",
        "human-step-up": "Requires an interactive human step-up proof. The browser demands a fresh, payload-bound, single-use second-factor proof for the change, and no machine credential can carry an equivalent proof that is bound to the operation payload, short-lived and not self-issued, so every machine surface refuses the operation."
    },
    "surface_exemption_reasons": {
        "mcp-credential-boundary": "MCP never accepts an authentication secret and never returns a newly issued credential (docs/mcp.md); REST and the protected console carry the secret.",
        "mcp-authority-boundary": "MCP never widens authority: role assignment, capability grants and extension package installation need controls a model-tool surface does not carry (docs/mcp.md). Authority-reducing counterparts are published.",
        "mcp-password-reproof": "The operation re-proves the caller's current password, which MCP cannot carry; a tool would always fail closed (docs/mcp.md).",
        "mcp-human-step-up": "The browser gates the change on an interactive human step-up proof that no machine credential can carry, so MCP does not publish it (docs/mcp.md)."
    },
    "routes": [
        {
            "name": "administrator.access-control",
            "methods": [
                "GET"
            ],
            "path": "/administrator/access",
            "handler": "Kumwe\\App\\Administrator\\Http\\Handler\\AdministratorAccessControlHandler",
            "operations": [
                {
                    "operation": "read",
                    "classification": "equivalent",
                    "service": "Kumwe\\App\\Identity\\Application\\Administration\\AccessControlService::users",
                    "rest": [
                        "listUsers",
                        "listRoles",
                        "listTokens",
                        "listSecurityEvents"
                    ],
                    "cli": [
                        "access users",
                        "access roles",
                        "access tokens",
                        "security-events list"
                    ],
                    "mcp": [
                        "kumwe_user_list",
                        "kumwe_role_list",
                        "kumwe_token_list",
                        "kumwe_security_event_list"
                    ],
                    "note": "Users, roles with the capability vocabulary, token metadata and the security-event timeline are the screen's four sections; each machine read calls the same AccessControlService method."
                }
            ]
        },
        {
            "name": "administrator.access-control.update",
            "methods": [
                "POST"
            ],
            "path": "/administrator/access",
            "handler": "Kumwe\\App\\Administrator\\Http\\Handler\\AdministratorAccessControlHandler",
            "operations": [
                {
                    "operation": "context.select",
                    "classification": "browser-only",
                    "reason": "session-context",
                    "note": "Selects the organization and workspace the browser session acts in and rotates the session cookie. A machine credential carries its scope from issue and is re-verified on every call."
                },
                {
                    "operation": "step_up.begin",
                    "classification": "browser-only",
                    "reason": "human-credential",
                    "note": "Begins enrolling the signed-in human's own authenticator; a machine credential is a bearer token and MCP never accepts an authentication secret."
                },
                {
                    "operation": "step_up.confirm",
                    "classification": "browser-only",
                    "reason": "human-credential",
                    "note": "Confirms the signed-in human's own authenticator enrollment with a one-time code."
                },
                {
                    "operation": "step_up.recovery.reissue",
                    "classification": "browser-only",
                    "reason": "human-credential",
                    "note": "Reissues the signed-in human's own step-up recovery codes after a fresh second-factor proof."
                },
                {
                    "operation": "user.create",
                    "classification": "equivalent",
                    "service": "Kumwe\\App\\Identity\\Application\\Administration\\AccessControlService::createUser",
                    "rest": [
                        "createUser"
                    ],
                    "cli": [
                        "access create-user"
                    ],
                    "mcp": [],
                    "exemptions": {
                        "mcp": {
                            "reason": "mcp-credential-boundary",
                            "note": "Creating an account sets its initial password, a secret the model-tool surface never accepts."
                        }
                    },
                    "assurance_gap": {
                        "browser": "payload-bound interactive human step-up proof",
                        "machine": "the site-bound bearer token alone, as the released v1 REST, CLI and MCP contracts define it",
                        "status": "pending-maintainer-decision"
                    },
                    "note": "The browser access screen demands a fresh payload-bound step-up proof for this change (AdministratorAccessControlHandler::stepUpPurpose)."
                },
                {
                    "operation": "user.update",
                    "classification": "equivalent",
                    "service": "Kumwe\\App\\Identity\\Application\\Administration\\AccessControlService::updateUser",
                    "rest": [
                        "updateUser"
                    ],
                    "cli": [
                        "access update-user"
                    ],
                    "mcp": [
                        "kumwe_user_update"
                    ],
                    "assurance_gap": {
                        "browser": "payload-bound interactive human step-up proof",
                        "machine": "the site-bound bearer token alone, as the released v1 REST, CLI and MCP contracts define it",
                        "status": "pending-maintainer-decision"
                    },
                    "note": "The browser access screen demands a fresh payload-bound step-up proof for this change (AdministratorAccessControlHandler::stepUpPurpose)."
                },
                {